Sheet: 2016_年度城镇人口增减情况统计年报表
A1: 城 镇 人 口 增 减 情 况 统 计 年 报 表
Z2: 表 号：公 业 58 表
N3: 2017 年度7月 | Z3: 文 号：公办〔2015〕53 号
Z4: 制表机关：公 安 部
A5: 填报单位：安徽省 | Z5: 备案机关：国 家 统 计 局
A6: 填报单位 | B6: 年末城镇人口数 | C6: 增 加 情 况 | X6: 减 少 情 况
C7: 合计 | D7: 出生 | E7: 退出现役 | F7: 港澳台人员和华侨回内地（回国）定居及外国人、无国籍人入籍 | G7: 城镇人口迁入 | I7: 农 业 转 移 人 口 落 户 城 镇 | W7: 其他 | X7: 合计 | Y7: 死亡 | Z7: 服现役 | AA7: 赴港澳台和国外定居及加入外国籍 | AB7: 城镇人口迁出 | AC7: 其他
G8: 省内迁入 | H8: 省外迁入 | I8: 小计 | J8: 来自地区 | M8: 增 加 原 因
J9: 本市(地) | K9: 本省外市 (地) | L9: 外省 | M9: 大中专院校招生 | N9: 录(聘)用 | O9: 务工经商 | P9: 投资 (创业) | Q9: 购(租)房 | R9: 投靠亲属 | S9: 移民搬迁 | T9: 城中村改造 | U9: 城乡属性调整 | V9: 其他
A16: 甲 | B16: 1 | C16: 2 | D16: 3 | E16: 4 | F16: 5 | G16: 6 | H16: 7 | I16: 8 | J16: 9 | K16: 10 | L16: 11 | M16: 12 | N16: 13 | O16: 14 | P16: 15 | Q16: 16 | R16: 17 | S16: 18 | T16: 19 | U16: 20 | V16: 21 | W16: 22 | X16: 23 | Y16: 24 | Z16: 25 | AA16: 26 | AB16: 27 | AC16: 28
A17: 安徽省 | B17: =R[1]C+R[12]C -> 5497500 | C17: =R[1]C+R[12]C -> 19886 | D17: =R[1]C+R[12]C -> 8142 | E17: =R[1]C+R[12]C -> 32 | F17: =R[1]C+R[12]C -> 1 | G17: =R[1]C+R[12]C -> 4086 | H17: =R[1]C+R[12]C -> 1826 | I17: =R[1]C+R[12]C -> 4524 | J17: =R[1]C+R[12]C -> 1999 | K17: =R[1]C+R[12]C -> 2104 | L17: =R[1]C+R[12]C -> 421 | M17: =R[1]C+R[12]C -> 1 | N17: =R[1]C+R[12]C -> 38 | O17: =R[1]C+R[12]C -> 5 | P17: =R[1]C+R[12]C -> 0 | Q17: =R[1]C+R[12]C -> 2441 | R17: =R[1]C+R[12]C -> 1330 | S17: =R[1]C+R[12]C -> 4 | T17: =R[1]C+R[12]C -> 0 | U17: =R[1]C+R[12]C -> 496 | V17: =R[1]C+R[12]C -> 209 | W17: =R[1]C+R[12]C -> 1275 | X17: =R[1]C+R[12]C -> 7025 | Y17: =R[1]C+R[12]C -> 1926 | Z17: =R[1]C+R[12]C -> 46 | AA17: =R[1]C+R[12]C -> 14 | AB17: =R[1]C+R[12]C -> 5003 | AC17: =R[1]C+R[12]C -> 36
A18: 合肥市 | B18: 3456915 | C18: 15509 | D18: 6267 | E18: 27 | F18: 1 | G18: 3608 | H18: 1287 | I18: 3119 | J18: 1045 | K18: 1809 | L18: 265 | M18: 1 | N18: 18 | O18: 5 | P18: 0 | Q18: 2062 | R18: 982 | S18: 0 | T18: 0 | U18: 0 | V18: =RC[-13]-RC[-9]-RC[-8]-RC[-7]-RC[-6]-RC[-5]-RC[-4]-RC[-3]-RC[-2]-RC[-1] -> 51 | W18: =RC[-20]-RC[-19]-RC[-18]-RC[-17]-RC[-16]-RC[-15]-RC[-14] -> 1200 | X18: 4520 | Y18: 1065 | Z18: 23 | AA18: 11 | AB18: 3394 | AC18: =RC[-5]-RC[-4]-RC[-3]-RC[-2]-RC[-1] -> 27
A19: 市辖区 | B19: 2560451 | C19: 13292 | D19: 5125 | E19: 24 | F19: 1 | G19: 3411 | H19: 1153 | I19: 2654 | J19: 816 | K19: 1629 | L19: 209 | M19: 1 | N19: 15 | O19: 5 | P19: 0 | Q19: 1850 | R19: 764 | S19: 0 | T19: 0 | U19: 0 | V19: =RC[-13]-RC[-9]-RC[-8]-RC[-7]-RC[-6]-RC[-5]-RC[-4]-RC[-3]-RC[-2]-RC[-1] -> 19 | W19: =RC[-20]-RC[-19]-RC[-18]-RC[-17]-RC[-16]-RC[-15]-RC[-14] -> 924 | X19: 2831 | Y19: 725 | Z19: 16 | AA19: 10 | AB19: 2070 | AC19: =RC[-5]-RC[-4]-RC[-3]-RC[-2]-RC[-1] -> 10
A20: 安徽省合肥市瑶海区 | B20: 618681 | C20: 2651 | D20: 1057 | E20: 1 | F20: 0 | G20: 644 | H20: 184 | I20: 489 | J20: 201 | K20: 247 | L20: 41 | M20: 0 | N20: 1 | O20: 4 | P20: 0 | Q20: 342 | R20: 139 | S20: 0 | T20: 0 | U20: 0 | V20: =RC[-13]-RC[-9]-RC[-8]-RC[-7]-RC[-6]-RC[-5]-RC[-4]-RC[-3]-RC[-2]-RC[-1] -> 3 | W20: =RC[-20]-RC[-19]-RC[-18]-RC[-17]-RC[-16]-RC[-15]-RC[-14] -> 276 | X20: 610 | Y20: 225 | Z20: 4 | AA20: 1 | AB20: 377 | AC20: =RC[-5]-RC[-4]-RC[-3]-RC[-2]-RC[-1] -> 3
A21: 安徽省合肥市庐阳区 | B21: 472226 | C21: 2047 | D21: 766 | E21: 8 | F21: 0 | G21: 419 | H21: 185 | I21: 531 | J21: 141 | K21: 354 | L21: 36 | M21: 0 | N21: 3 | O21: 0 | P21: 0 | Q21: 376 | R21: 148 | S21: 0 | T21: 0 | U21: 0 | V21: =RC[-13]-RC[-9]-RC[-8]-RC[-7]-RC[-6]-RC[-5]-RC[-4]-RC[-3]-RC[-2]-RC[-1] -> 4 | W21: =RC[-20]-RC[-19]-RC[-18]-RC[-17]-RC[-16]-RC[-15]-RC[-14] -> 138 | X21: 541 | Y21: 147 | Z21: 1 | AA21: 2 | AB21: 389 | AC21: =RC[-5]-RC[-4]-RC[-3]-RC[-2]-RC[-1] -> 2
A22: 安徽省合肥市蜀山区 | B22: 880536 | C22: 5200 | D22: 2054 | E22: 10 | F22: 0 | G22: 1449 | H22: 491 | I22: 924 | J22: 259 | K22: 590 | L22: 75 | M22: 1 | N22: 7 | O22: 1 | P22: 0 | Q22: 599 | R22: 307 | S22: 0 | T22: 0 | U22: 0 | V22: =RC[-13]-RC[-9]-RC[-8]-RC[-7]-RC[-6]-RC[-5]-RC[-4]-RC[-3]-RC[-2]-RC[-1] -> 9 | W22: =RC[-20]-RC[-19]-RC[-18]-RC[-17]-RC[-16]-RC[-15]-RC[-14] -> 272 | X22: 1069 | Y22: 219 | Z22: 6 | AA22: 4 | AB22: 836 | AC22: =RC[-5]-RC[-4]-RC[-3]-RC[-2]-RC[-1] -> 4
A23: 安徽省合肥市包河区 | B23: 589008 | C23: 3394 | D23: 1248 | E23: 5 | F23: 1 | G23: 899 | H23: 293 | I23: 710 | J23: 215 | K23: 438 | L23: 57 | M23: 0 | N23: 4 | O23: 0 | P23: 0 | Q23: 533 | R23: 170 | S23: 0 | T23: 0 | U23: 0 | V23: =RC[-13]-RC[-9]-RC[-8]-RC[-7]-RC[-6]-RC[-5]-RC[-4]-RC[-3]-RC[-2]-RC[-1] -> 3 | W23: =RC[-20]-RC[-19]-RC[-18]-RC[-17]-RC[-16]-RC[-15]-RC[-14] -> 238 | X23: 611 | Y23: 134 | Z23: 5 | AA23: 3 | AB23: 468 | AC23: =RC[-5]-RC[-4]-RC[-3]-RC[-2]-RC[-1] -> 1
A24: 安徽省长丰县 | B24: 192721 | C24: 622 | D24: 339 | E24: 1 | F24: 0 | G24: 48 | H24: 28 | I24: 106 | J24: 81 | K24: 19 | L24: 6 | M24: 0 | N24: 0 | O24: 0 | P24: 0 | Q24: 20 | R24: 67 | S24: 0 | T24: 0 | U24: 0 | V24: =RC[-13]-RC[-9]-RC[-8]-RC[-7]-RC[-6]-RC[-5]-RC[-4]-RC[-3]-RC[-2]-RC[-1] -> 19 | W24: =RC[-20]-RC[-19]-RC[-18]-RC[-17]-RC[-16]-RC[-15]-RC[-14] -> 100 | X24: 348 | Y24: 61 | Z24: 1 | AA24: 0 | AB24: 278 | AC24: =RC[-5]-RC[-4]-RC[-3]-RC[-2]-RC[-1] -> 8
A25: 安徽省肥东县 | B25: 150028 | C25: 262 | D25: 161 | E25: 1 | F25: 0 | G25: 10 | H25: 18 | I25: 54 | J25: 33 | K25: 12 | L25: 9 | M25: 0 | N25: 2 | O25: 0 | P25: 0 | Q25: 12 | R25: 34 | S25: 0 | T25: 0 | U25: 0 | V25: =RC[-13]-RC[-9]-RC[-8]-RC[-7]-RC[-6]-RC[-5]-RC[-4]-RC[-3]-RC[-2]-RC[-1] -> 6 | W25: =RC[-20]-RC[-19]-RC[-18]-RC[-17]-RC[-16]-RC[-15]-RC[-14] -> 18 | X25: 310 | Y25: 71 | Z25: 2 | AA25: 0 | AB25: 234 | AC25: =RC[-5]-RC[-4]-RC[-3]-RC[-2]-RC[-1] -> 3
A26: 安徽省肥西县 | B26: 157035 | C26: 698 | D26: 297 | E26: 1 | F26: 0 | G26: 85 | H26: 23 | I26: 188 | J26: 37 | K26: 129 | L26: 22 | M26: 0 | N26: 1 | O26: 0 | P26: 0 | Q26: 141 | R26: 43 | S26: 0 | T26: 0 | U26: 0 | V26: =RC[-13]-RC[-9]-RC[-8]-RC[-7]-RC[-6]-RC[-5]-RC[-4]-RC[-3]-RC[-2]-RC[-1] -> 3 | W26: =RC[-20]-RC[-19]-RC[-18]-RC[-17]-RC[-16]-RC[-15]-RC[-14] -> 104 | X26: 341 | Y26: 62 | Z26: 1 | AA26: 1 | AB26: 276 | AC26: =RC[-5]-RC[-4]-RC[-3]-RC[-2]-RC[-1] -> 1
A27: 安徽省庐江县 | B27: 191225 | C27: 287 | D27: 175 | E27: 0 | F27: 0 | G27: 5 | H27: 14 | I27: 87 | J27: 67 | K27: 12 | L27: 8 | M27: 0 | N27: 0 | O27: 0 | P27: 0 | Q27: 23 | R27: 61 | S27: 0 | T27: 0 | U27: 0 | V27: =RC[-13]-RC[-9]-RC[-8]-RC[-7]-RC[-6]-RC[-5]-RC[-4]-RC[-3]-RC[-2]-RC[-1] -> 3 | W27: =RC[-20]-RC[-19]-RC[-18]-RC[-17]-RC[-16]-RC[-15]-RC[-14] -> 6 | X27: 328 | Y27: 107 | Z27: 1 | AA27: 0 | AB27: 217 | AC27: =RC[-5]-RC[-4]-RC[-3]-RC[-2]-RC[-1] -> 3
A28: 安徽省巢湖市 | B28: 205455 | C28: 348 | D28: 170 | E28: 0 | F28: 0 | G28: 49 | H28: 51 | I28: 30 | J28: 11 | K28: 8 | L28: 11 | M28: 0 | N28: 0 | O28: 0 | P28: 0 | Q28: 16 | R28: 13 | S28: 0 | T28: 0 | U28: 0 | V28: =RC[-13]-RC[-9]-RC[-8]-RC[-7]-RC[-6]-RC[-5]-RC[-4]-RC[-3]-RC[-2]-RC[-1] -> 1 | W28: =RC[-20]-RC[-19]-RC[-18]-RC[-17]-RC[-16]-RC[-15]-RC[-14] -> 48 | X28: 362 | Y28: 39 | Z28: 2 | AA28: 0 | AB28: 319 | AC28: =RC[-5]-RC[-4]-RC[-3]-RC[-2]-RC[-1] -> 2
A29: 芜湖市 | B29: 2040585 | C29: 4377 | D29: 1875 | E29: 5 | F29: 0 | G29: 478 | H29: 539 | I29: 1405 | J29: 954 | K29: 295 | L29: 156 | M29: 0 | N29: 20 | O29: 0 | P29: 0 | Q29: 379 | R29: 348 | S29: 4 | T29: 0 | U29: 496 | V29: =RC[-13]-RC[-9]-RC[-8]-RC[-7]-RC[-6]-RC[-5]-RC[-4]-RC[-3]-RC[-2]-RC[-1] -> 158 | W29: =RC[-20]-RC[-19]-RC[-18]-RC[-17]-RC[-16]-RC[-15]-RC[-14] -> 75 | X29: 2505 | Y29: 861 | Z29: 23 | AA29: 3 | AB29: 1609 | AC29: =RC[-5]-RC[-4]-RC[-3]-RC[-2]-RC[-1] -> 9
A30: 市辖区 | B30: 1096258 | C30: 3132 | D30: 1092 | E30: 5 | F30: 0 | G30: 425 | H30: 384 | I30: 1209 | J30: 864 | K30: 247 | L30: 98 | M30: 0 | N30: 11 | O30: 0 | P30: 0 | Q30: 370 | R30: 192 | S30: 4 | T30: 0 | U30: 496 | V30: =RC[-13]-RC[-9]-RC[-8]-RC[-7]-RC[-6]-RC[-5]-RC[-4]-RC[-3]-RC[-2]-RC[-1] -> 136 | W30: =RC[-20]-RC[-19]-RC[-18]-RC[-17]-RC[-16]-RC[-15]-RC[-14] -> 17 | X30: 1368 | Y30: 531 | Z30: 8 | AA30: 2 | AB30: 827 | AC30: =RC[-5]-RC[-4]-RC[-3]-RC[-2]-RC[-1] -> 0
A31: 安徽省芜湖市镜湖区 | B31: 426703 | C31: 770 | D31: 310 | E31: 3 | F31: 0 | G31: 122 | H31: 155 | I31: 175 | J31: 96 | K31: 53 | L31: 26 | M31: 0 | N31: 7 | O31: 0 | P31: 0 | Q31: 69 | R31: 41 | S31: 1 | T31: 0 | U31: 0 | V31: =RC[-13]-RC[-9]-RC[-8]-RC[-7]-RC[-6]-RC[-5]-RC[-4]-RC[-3]-RC[-2]-RC[-1] -> 57 | W31: =RC[-20]-RC[-19]-RC[-18]-RC[-17]-RC[-16]-RC[-15]-RC[-14] -> 5 | X31: 467 | Y31: 251 | Z31: 1 | AA31: 1 | AB31: 214 | AC31: =RC[-5]-RC[-4]-RC[-3]-RC[-2]-RC[-1] -> 0
A32: 安徽省芜湖市弋江区 | B32: 235446 | C32: 1098 | D32: 246 | E32: 1 | F32: 0 | G32: 76 | H32: 64 | I32: 708 | J32: 604 | K32: 66 | L32: 38 | M32: 0 | N32: 3 | O32: 0 | P32: 0 | Q32: 95 | R32: 47 | S32: 0 | T32: 0 | U32: 496 | V32: =RC[-13]-RC[-9]-RC[-8]-RC[-7]-RC[-6]-RC[-5]-RC[-4]-RC[-3]-RC[-2]-RC[-1] -> 67 | W32: =RC[-20]-RC[-19]-RC[-18]-RC[-17]-RC[-16]-RC[-15]-RC[-14] -> 3 | X32: 239 | Y32: 83 | Z32: 4 | AA32: 1 | AB32: 151 | AC32: =RC[-5]-RC[-4]-RC[-3]-RC[-2]-RC[-1] -> 0
A33: 安徽省芜湖市鸠江区 | B33: 359897 | C33: 1085 | D33: 463 | E33: 1 | F33: 0 | G33: 190 | H33: 131 | I33: 292 | J33: 141 | K33: 119 | L33: 32 | M33: 0 | N33: 1 | O33: 0 | P33: 0 | Q33: 201 | R33: 79 | S33: 0 | T33: 0 | U33: 0 | V33: =RC[-13]-RC[-9]-RC[-8]-RC[-7]-RC[-6]-RC[-5]-RC[-4]-RC[-3]-RC[-2]-RC[-1] -> 11 | W33: =RC[-20]-RC[-19]-RC[-18]-RC[-17]-RC[-16]-RC[-15]-RC[-14] -> 8 | X33: 513 | Y33: 162 | Z33: 3 | AA33: 0 | AB33: 348 | AC33: =RC[-5]-RC[-4]-RC[-3]-RC[-2]-RC[-1] -> 0
A34: 安徽省芜湖市三山区 | B34: 74212 | C34: 179 | D34: 73 | E34: 0 | F34: 0 | G34: 37 | H34: 34 | I34: 34 | J34: 23 | K34: 9 | L34: 2 | M34: 0 | N34: 0 | O34: 0 | P34: 0 | Q34: 5 | R34: 25 | S34: 3 | T34: 0 | U34: 0 | V34: =RC[-13]-RC[-9]-RC[-8]-RC[-7]-RC[-6]-RC[-5]-RC[-4]-RC[-3]-RC[-2]-RC[-1] -> 1 | W34: =RC[-20]-RC[-19]-RC[-18]-RC[-17]-RC[-16]-RC[-15]-RC[-14] -> 1 | X34: 149 | Y34: 35 | Z34: 0 | AA34: 0 | AB34: 114 | AC34: =RC[-5]-RC[-4]-RC[-3]-RC[-2]-RC[-1] -> 0
A35: 安徽省芜湖县 | B35: 145853 | C35: 188 | D35: 125 | E35: 0 | F35: 0 | G35: 6 | H35: 22 | I35: 34 | J35: 15 | K35: 8 | L35: 11 | M35: 0 | N35: 3 | O35: 0 | P35: 0 | Q35: 3 | R35: 25 | S35: 0 | T35: 0 | U35: 0 | V35: =RC[-13]-RC[-9]-RC[-8]-RC[-7]-RC[-6]-RC[-5]-RC[-4]-RC[-3]-RC[-2]-RC[-1] -> 3 | W35: =RC[-20]-RC[-19]-RC[-18]-RC[-17]-RC[-16]-RC[-15]-RC[-14] -> 1 | X35: 211 | Y35: 75 | Z35: 1 | AA35: 0 | AB35: 135 | AC35: =RC[-5]-RC[-4]-RC[-3]-RC[-2]-RC[-1] -> 0
A36: 安徽省繁昌县 | B36: 103134 | C36: 138 | D36: 81 | E36: 0 | F36: 0 | G36: 11 | H36: 25 | I36: 20 | J36: 15 | K36: 3 | L36: 2 | M36: 0 | N36: 0 | O36: 0 | P36: 0 | Q36: 2 | R36: 13 | S36: 0 | T36: 0 | U36: 0 | V36: =RC[-13]-RC[-9]-RC[-8]-RC[-7]-RC[-6]-RC[-5]-RC[-4]-RC[-3]-RC[-2]-RC[-1] -> 5 | W36: =RC[-20]-RC[-19]-RC[-18]-RC[-17]-RC[-16]-RC[-15]-RC[-14] -> 1 | X36: 123 | Y36: 23 | Z36: 0 | AA36: 0 | AB36: 98 | AC36: =RC[-5]-RC[-4]-RC[-3]-RC[-2]-RC[-1] -> 2
A37: 安徽省南陵县 | B37: 227741 | C37: 299 | D37: 216 | E37: 0 | F37: 0 | G37: 5 | H37: 27 | I37: 45 | J37: 19 | K37: 13 | L37: 13 | M37: 0 | N37: 2 | O37: 0 | P37: 0 | Q37: 4 | R37: 33 | S37: 0 | T37: 0 | U37: 0 | V37: =RC[-13]-RC[-9]-RC[-8]-RC[-7]-RC[-6]-RC[-5]-RC[-4]-RC[-3]-RC[-2]-RC[-1] -> 6 | W37: =RC[-20]-RC[-19]-RC[-18]-RC[-17]-RC[-16]-RC[-15]-RC[-14] -> 6 | X37: 245 | Y37: 78 | Z37: 2 | AA37: 1 | AB37: 164 | AC37: =RC[-5]-RC[-4]-RC[-3]-RC[-2]-RC[-1] -> 0
A38: 安徽省芜湖市无为县 | B38: 467599 | C38: 620 | D38: 361 | E38: 0 | F38: 0 | G38: 31 | H38: 81 | I38: 97 | J38: 41 | K38: 24 | L38: 32 | M38: 0 | N38: 4 | O38: 0 | P38: 0 | Q38: 0 | R38: 85 | S38: 0 | T38: 0 | U38: 0 | V38: =RC[-13]-RC[-9]-RC[-8]-RC[-7]-RC[-6]-RC[-5]-RC[-4]-RC[-3]-RC[-2]-RC[-1] -> 8 | W38: =RC[-20]-RC[-19]-RC[-18]-RC[-17]-RC[-16]-RC[-15]-RC[-14] -> 50 | X38: 558 | Y38: 154 | Z38: 12 | AA38: 0 | AB38: 385 | AC38: =RC[-5]-RC[-4]-RC[-3]-RC[-2]-RC[-1] -> 7
A39: 备注： | B39: 一、在“农业转移人口落户城镇”中，农村籍大中专院校毕业生6748人,在城镇就业和居住五年以上的农业转移人口20785人，举家迁徙的农业转移人口15384人，农村籍退出现役人员1742人。二、在“城镇人口迁入”和“农业转移人口落户城镇”中，具有专业技术职称的1565人，具有技能等级的1256人。
A40: 审核人： | Q40: 填表人： | R40: 安徽省 | Z40: 2016年12月28日 | AC40: 填